{
  "id": "shiro_turbo",
  "display_name": "Shiro Turbo",
  "class": "Sport",
  "analog_of": "early-2000s Japanese FR coupe, 2.0 L turbocharged I4, clutch LSD",
  "body_size_m": [1.695, 4.445, 1.285],
  "mass_kg": 1325.0,
  "front_weight_frac": 0.55,
  "wheelbase_m": 2.525,
  "track_front_m": 1.48,
  "track_rear_m": 1.47,
  "cg_height_m": 0.46,
  "inertia_kgm2": [400.0, 2080.0, 2200.0],
  "drag_cd_a_m2": 0.531,
  "lift_front": 0.06,
  "lift_rear": 0.08,
  "engine": {
    "torque_curve_nm": [
      [1000, 140],
      [1500, 170],
      [2000, 205],
      [2500, 240],
      [3000, 258],
      [3500, 266],
      [4000, 272],
      [4500, 275],
      [5000, 276],
      [5500, 272],
      [6000, 268],
      [6500, 268],
      [7000, 240],
      [7500, 205]
    ],
    "idle_rpm": 850.0,
    "redline_rpm": 7200.0,
    "rev_limit_rpm": 7500.0,
    "inertia_kgm2": 0.13,
    "engine_brake_nm": 33.0
  },
  "drivetrain": {
    "layout": "Rwd",
    "gear_ratios": [3.32, 1.9, 1.31, 1.0, 0.76, 0.66],
    "final_drive": 4.08,
    "reverse_ratio": 3.38,
    "diff_front": "Open",
    "diff_rear": {
      "Lsd": {
        "preload_nm": 60.0,
        "ramp_power": 0.45,
        "ramp_coast": 0.3
      }
    },
    "clutch_max_nm": 400.0,
    "shift_time_s": 0.22
  },
  "wheels": [
    {
      "position_m": [-0.74, 1.262, 0.303],
      "radius_m": 0.303,
      "width_m": 0.215,
      "mass_kg": 20.0,
      "tire_id": "sport",
      "steerable": true,
      "max_steer_rad": 0.601,
      "ackermann_frac": 0.5,
      "camber_rad": -0.0175,
      "toe_rad": 0.0,
      "caster_rad": 0.1047
    },
    {
      "position_m": [0.74, 1.262, 0.303],
      "radius_m": 0.303,
      "width_m": 0.215,
      "mass_kg": 20.0,
      "tire_id": "sport",
      "steerable": true,
      "max_steer_rad": 0.601,
      "ackermann_frac": 0.5,
      "camber_rad": -0.0175,
      "toe_rad": 0.0,
      "caster_rad": 0.1047
    },
    {
      "position_m": [-0.735, -1.262, 0.308],
      "radius_m": 0.308,
      "width_m": 0.225,
      "mass_kg": 22.0,
      "tire_id": "sport",
      "steerable": false,
      "max_steer_rad": 0.0,
      "ackermann_frac": 0.0,
      "camber_rad": -0.0227,
      "toe_rad": 0.0035,
      "caster_rad": 0.0
    },
    {
      "position_m": [0.735, -1.262, 0.308],
      "radius_m": 0.308,
      "width_m": 0.225,
      "mass_kg": 22.0,
      "tire_id": "sport",
      "steerable": false,
      "max_steer_rad": 0.0,
      "ackermann_frac": 0.0,
      "camber_rad": -0.0227,
      "toe_rad": 0.0035,
      "caster_rad": 0.0
    }
  ],
  "suspension": [
    {
      "spring_n_per_m": 46500.0,
      "damper_bump_ns_per_m": 2560.0,
      "damper_rebound_ns_per_m": 3840.0,
      "travel_m": 0.13,
      "preload_m": 0.02,
      "arb_n_per_m": 13700.0,
      "bump_stop_n_per_m": 170000.0
    },
    {
      "spring_n_per_m": 46500.0,
      "damper_bump_ns_per_m": 2560.0,
      "damper_rebound_ns_per_m": 3840.0,
      "travel_m": 0.13,
      "preload_m": 0.02,
      "arb_n_per_m": 13700.0,
      "bump_stop_n_per_m": 170000.0
    },
    {
      "spring_n_per_m": 41500.0,
      "damper_bump_ns_per_m": 2170.0,
      "damper_rebound_ns_per_m": 3260.0,
      "travel_m": 0.14,
      "preload_m": 0.02,
      "arb_n_per_m": 4200.0,
      "bump_stop_n_per_m": 170000.0
    },
    {
      "spring_n_per_m": 41500.0,
      "damper_bump_ns_per_m": 2170.0,
      "damper_rebound_ns_per_m": 3260.0,
      "travel_m": 0.14,
      "preload_m": 0.02,
      "arb_n_per_m": 4200.0,
      "bump_stop_n_per_m": 170000.0
    }
  ],
  "brakes": {
    "max_torque_front_nm": 2600.0,
    "max_torque_rear_nm": 1020.0,
    "bias_front": 0.514,
    "handbrake_rear_nm": 1010.0
  },
  "steering": {
    "ratio": 15.0,
    "rack_speed_rad_per_s": 1.6,
    "ffb_scale": 1.0
  },
  "aero_downforce_coeffs": [0.0, 0.0],
  "lattice_id": "shiro_turbo",
  "base_price": 28000,
  "durability_class": 2
}
