{
  "id": "sentinel_vanguard",
  "display_name": "Sentinel Vanguard",
  "class": "PoliceInterceptor",
  "analog_of": "2010s American AWD police pursuit sedan, 3.5 L twin-turbo V6",
  "body_size_m": [1.94, 5.05, 1.55],
  "mass_kg": 2075.0,
  "front_weight_frac": 0.56,
  "wheelbase_m": 2.87,
  "track_front_m": 1.66,
  "track_rear_m": 1.66,
  "cg_height_m": 0.56,
  "inertia_kgm2": [850.0, 4440.0, 4760.0],
  "drag_cd_a_m2": 0.884,
  "lift_front": 0.08,
  "lift_rear": 0.1,
  "engine": {
    "torque_curve_nm": [
      [800, 260],
      [1200, 330],
      [1600, 400],
      [2000, 455],
      [2500, 495],
      [3000, 495],
      [3500, 495],
      [4000, 495],
      [4500, 490],
      [5000, 490],
      [5500, 472],
      [6000, 420],
      [6300, 380]
    ],
    "idle_rpm": 650.0,
    "redline_rpm": 6000.0,
    "rev_limit_rpm": 6300.0,
    "inertia_kgm2": 0.18,
    "engine_brake_nm": 50.0
  },
  "drivetrain": {
    "layout": {
      "Awd": {
        "front_split": 0.55
      }
    },
    "gear_ratios": [4.48, 2.87, 1.84, 1.41, 1.0, 0.74],
    "final_drive": 3.16,
    "reverse_ratio": 2.88,
    "diff_front": "Open",
    "diff_rear": "Open",
    "clutch_max_nm": 790.0,
    "shift_time_s": 0.3
  },
  "wheels": [
    {
      "position_m": [-0.83, 1.435, 0.352],
      "radius_m": 0.352,
      "width_m": 0.245,
      "mass_kg": 28.0,
      "tire_id": "street",
      "steerable": true,
      "max_steer_rad": 0.577,
      "ackermann_frac": 0.6,
      "camber_rad": -0.0105,
      "toe_rad": 0.0,
      "caster_rad": 0.096
    },
    {
      "position_m": [0.83, 1.435, 0.352],
      "radius_m": 0.352,
      "width_m": 0.245,
      "mass_kg": 28.0,
      "tire_id": "street",
      "steerable": true,
      "max_steer_rad": 0.577,
      "ackermann_frac": 0.6,
      "camber_rad": -0.0105,
      "toe_rad": 0.0,
      "caster_rad": 0.096
    },
    {
      "position_m": [-0.83, -1.435, 0.352],
      "radius_m": 0.352,
      "width_m": 0.245,
      "mass_kg": 28.0,
      "tire_id": "street",
      "steerable": false,
      "max_steer_rad": 0.0,
      "ackermann_frac": 0.0,
      "camber_rad": -0.0157,
      "toe_rad": 0.0026,
      "caster_rad": 0.0
    },
    {
      "position_m": [0.83, -1.435, 0.352],
      "radius_m": 0.352,
      "width_m": 0.245,
      "mass_kg": 28.0,
      "tire_id": "street",
      "steerable": false,
      "max_steer_rad": 0.0,
      "ackermann_frac": 0.0,
      "camber_rad": -0.0157,
      "toe_rad": 0.0026,
      "caster_rad": 0.0
    }
  ],
  "suspension": [
    {
      "spring_n_per_m": 49100.0,
      "damper_bump_ns_per_m": 3130.0,
      "damper_rebound_ns_per_m": 4700.0,
      "travel_m": 0.17,
      "preload_m": 0.02,
      "arb_n_per_m": 14600.0,
      "bump_stop_n_per_m": 170000.0
    },
    {
      "spring_n_per_m": 49100.0,
      "damper_bump_ns_per_m": 3130.0,
      "damper_rebound_ns_per_m": 4700.0,
      "travel_m": 0.17,
      "preload_m": 0.02,
      "arb_n_per_m": 14600.0,
      "bump_stop_n_per_m": 170000.0
    },
    {
      "spring_n_per_m": 43300.0,
      "damper_bump_ns_per_m": 2580.0,
      "damper_rebound_ns_per_m": 3870.0,
      "travel_m": 0.18,
      "preload_m": 0.02,
      "arb_n_per_m": 4400.0,
      "bump_stop_n_per_m": 170000.0
    },
    {
      "spring_n_per_m": 43300.0,
      "damper_bump_ns_per_m": 2580.0,
      "damper_rebound_ns_per_m": 3870.0,
      "travel_m": 0.18,
      "preload_m": 0.02,
      "arb_n_per_m": 4400.0,
      "bump_stop_n_per_m": 170000.0
    }
  ],
  "brakes": {
    "max_torque_front_nm": 5770.0,
    "max_torque_rear_nm": 1790.0,
    "bias_front": 0.74,
    "handbrake_rear_nm": 1440.0
  },
  "steering": {
    "ratio": 15.5,
    "rack_speed_rad_per_s": 1.4,
    "ffb_scale": 1.0
  },
  "aero_downforce_coeffs": [0.0, 0.0],
  "lattice_id": "sentinel_vanguard",
  "base_price": 45000,
  "durability_class": 4
}
