{
  "id": "kestrel_ts",
  "display_name": "Kestrel TS",
  "class": "Sport",
  "analog_of": "mid-2000s Japanese FF sport sedan, 2.0 L turbocharged I4 (AWD variant via mod)",
  "body_size_m": [1.77, 4.6, 1.45],
  "mass_kg": 1475.0,
  "front_weight_frac": 0.61,
  "wheelbase_m": 2.64,
  "track_front_m": 1.53,
  "track_rear_m": 1.52,
  "cg_height_m": 0.52,
  "inertia_kgm2": [510.0, 2570.0, 2750.0],
  "drag_cd_a_m2": 0.668,
  "lift_front": 0.08,
  "lift_rear": 0.1,
  "engine": {
    "torque_curve_nm": [
      [1000, 150],
      [1500, 205],
      [2000, 280],
      [2500, 330],
      [3000, 335],
      [3500, 335],
      [4000, 333],
      [4500, 325],
      [5000, 310],
      [5500, 295],
      [6000, 288],
      [6500, 262],
      [6800, 240]
    ],
    "idle_rpm": 800.0,
    "redline_rpm": 6500.0,
    "rev_limit_rpm": 6800.0,
    "inertia_kgm2": 0.13,
    "engine_brake_nm": 37.0
  },
  "drivetrain": {
    "layout": "Fwd",
    "gear_ratios": [3.54, 2.13, 1.48, 1.12, 0.89, 0.73],
    "final_drive": 4.06,
    "reverse_ratio": 3.3,
    "diff_front": {
      "Lsd": {
        "preload_nm": 40.0,
        "ramp_power": 0.3,
        "ramp_coast": 0.1
      }
    },
    "diff_rear": "Open",
    "clutch_max_nm": 450.0,
    "shift_time_s": 0.25
  },
  "wheels": [
    {
      "position_m": [-0.765, 1.32, 0.308],
      "radius_m": 0.308,
      "width_m": 0.225,
      "mass_kg": 22.0,
      "tire_id": "street",
      "steerable": true,
      "max_steer_rad": 0.578,
      "ackermann_frac": 0.6,
      "camber_rad": -0.0122,
      "toe_rad": 0.0,
      "caster_rad": 0.0785
    },
    {
      "position_m": [0.765, 1.32, 0.308],
      "radius_m": 0.308,
      "width_m": 0.225,
      "mass_kg": 22.0,
      "tire_id": "street",
      "steerable": true,
      "max_steer_rad": 0.578,
      "ackermann_frac": 0.6,
      "camber_rad": -0.0122,
      "toe_rad": 0.0,
      "caster_rad": 0.0785
    },
    {
      "position_m": [-0.76, -1.32, 0.308],
      "radius_m": 0.308,
      "width_m": 0.225,
      "mass_kg": 20.0,
      "tire_id": "street",
      "steerable": false,
      "max_steer_rad": 0.0,
      "ackermann_frac": 0.0,
      "camber_rad": -0.0209,
      "toe_rad": 0.0026,
      "caster_rad": 0.0
    },
    {
      "position_m": [0.76, -1.32, 0.308],
      "radius_m": 0.308,
      "width_m": 0.225,
      "mass_kg": 20.0,
      "tire_id": "street",
      "steerable": false,
      "max_steer_rad": 0.0,
      "ackermann_frac": 0.0,
      "camber_rad": -0.0209,
      "toe_rad": 0.0026,
      "caster_rad": 0.0
    }
  ],
  "suspension": [
    {
      "spring_n_per_m": 38000.0,
      "damper_bump_ns_per_m": 2420.0,
      "damper_rebound_ns_per_m": 3630.0,
      "travel_m": 0.16,
      "preload_m": 0.02,
      "arb_n_per_m": 8600.0,
      "bump_stop_n_per_m": 150000.0
    },
    {
      "spring_n_per_m": 38000.0,
      "damper_bump_ns_per_m": 2420.0,
      "damper_rebound_ns_per_m": 3630.0,
      "travel_m": 0.16,
      "preload_m": 0.02,
      "arb_n_per_m": 8600.0,
      "bump_stop_n_per_m": 150000.0
    },
    {
      "spring_n_per_m": 27000.0,
      "damper_bump_ns_per_m": 1610.0,
      "damper_rebound_ns_per_m": 2420.0,
      "travel_m": 0.17,
      "preload_m": 0.02,
      "arb_n_per_m": 9300.0,
      "bump_stop_n_per_m": 150000.0
    },
    {
      "spring_n_per_m": 27000.0,
      "damper_bump_ns_per_m": 1610.0,
      "damper_rebound_ns_per_m": 2420.0,
      "travel_m": 0.17,
      "preload_m": 0.02,
      "arb_n_per_m": 9300.0,
      "bump_stop_n_per_m": 150000.0
    }
  ],
  "brakes": {
    "max_torque_front_nm": 2550.0,
    "max_torque_rear_nm": 1040.0,
    "bias_front": 0.78,
    "handbrake_rear_nm": 830.0
  },
  "steering": {
    "ratio": 15.0,
    "rack_speed_rad_per_s": 1.4,
    "ffb_scale": 1.0
  },
  "aero_downforce_coeffs": [0.0, 0.0],
  "lattice_id": "kestrel_ts",
  "base_price": 22000,
  "durability_class": 3
}
